{
  "adapter": {
    "asset_roles": [
      "data"
    ],
    "family": "stac_search",
    "media_types": [
      "image/tiff; application=geotiff; profile=cloud-optimized"
    ],
    "public_adapter_id": "stac_api"
  },
  "asset_access": {
    "mode": "direct_https",
    "stable_identity": {
      "href_policy": "selected_stac_asset"
    }
  },
  "blocked_before_network": false,
  "blocked_details": [],
  "capabilities": {
    "analysis": false,
    "materialization": true,
    "planning": true,
    "preview": true,
    "temporal_discovery": false
  },
  "credential_requirement": null,
  "endpoint_contract": {
    "endpoint": "https://earth-search.aws.element84.com/v1",
    "family_contract": {
      "asset_host_scope": [
        "copernicus-dem-30m.s3.eu-central-1.amazonaws.com"
      ],
      "asset_selection": {
        "item_limit": 4,
        "item_order": [
          "datetime",
          "id"
        ],
        "required_media_types": [
          "image/tiff; application=geotiff; profile=cloud-optimized"
        ],
        "required_roles": [
          "data"
        ]
      },
      "bbox_crs": "EPSG:4326",
      "search_path": "/search",
      "temporal_representation": "datetime"
    },
    "kind": "stac_search",
    "rendered_request_url": null,
    "url_template": null
  },
  "evidence_bundle_sha256": "cb62139c619c3071abc3ce58e806b554dd9942cca6219f06253767cf907448a7",
  "executable": true,
  "identity": {
    "collection": "cop-dem-glo-30",
    "product": "Copernicus DEM GLO-30",
    "provider": "ELEMENT84_EARTH_SEARCH"
  },
  "network_policy": {
    "asset_host_suffixes": [],
    "asset_hosts": [
      "copernicus-dem-30m.s3.eu-central-1.amazonaws.com"
    ],
    "default": "disabled",
    "max_asset_bytes": 75000000,
    "max_bytes": 65536,
    "max_parallel_requests": 1,
    "max_requests": 3,
    "max_total_bytes": 76000000,
    "maximum_redirects": 0,
    "redirect_hosts": [],
    "request_hosts": [
      "earth-search.aws.element84.com"
    ],
    "resolver_host_suffixes": [],
    "resolver_hosts": [],
    "timeout_seconds": 30.0
  },
  "original_pack_unchanged": true,
  "pack_id": "earth-search-copdem-https",
  "plan_sha256": "949624942daf983330478ef22dd52c1f75de83b88a1b9ee473f9fc6a64d45ba4",
  "preview": {
    "role": "natural_color",
    "target_crs": "EPSG:32614",
    "template_id": "general_multisource_v1",
    "theme": "elevation"
  },
  "provider_evidence": {
    "evidence_sha256": "cb62139c619c3071abc3ce58e806b554dd9942cca6219f06253767cf907448a7",
    "official_documentation": [
      "https://earth-search.aws.element84.com/v1"
    ],
    "status": "complete"
  },
  "public_capability": {
    "private_execution_available_from_public_repository": false,
    "public_execution": "validation_and_bounded_probe_only",
    "release": "Unreleased",
    "status": "experimental"
  },
  "requested_time": null,
  "resolved_time": null,
  "schema_version": "fasterraster.source-pack-plan/v2",
  "source_content_identity_sha256": "9aa3a492146c14dc7e5d2a06a85f76e34ebecc02c11c6198626edd101be72b60",
  "source_contract": {
    "crs": "EPSG:4326",
    "mask_policy": "all_valid",
    "nodata": null,
    "resampling": "bilinear",
    "semantic_type": "continuous"
  },
  "source_pack_sha256": "3ae6192ca1be367e09efb371ba435377b272901fdbc048c67ab14369c024971e",
  "status": "READY",
  "temporal_alternatives": null,
  "temporal_contract": {
    "mode": "static",
    "requested": null,
    "template_variables": {},
    "tolerance_days": null
  },
  "temporal_resolution": null,
  "validation": {
    "family_contract": "VALID",
    "offline_planning": "READY_FOR_OFFLINE_DETERMINISTIC_PLANNING",
    "provider_evidence": "COMPLETE",
    "schema": "SCHEMA_VALID",
    "validation_sha256": "8fd37207630e4b332f3e18f423f1279c7d9c103fdd096b0a4e52f54d102ef117"
  }
}
